Притомил{ся|ась} уже? Ничего, скоро все будет готово. Отдохни пока и сходи к моему давнему другу Мельхору, что живет в Кхатоге. Скажи, что приш{ел|ла} от меня по важному поручению, пусть даст тебе сок закатной ягоды. Он насыщается лучами заходящего солнца и будет важным ингредиентом нашего снадобья.\n%=12275%
Тебе нужно выбрать противника по собственным силам, монстра или же врага твоей расы, и сразиться с ним на Снежном острове или в Пещере Холода. Крупица может попасть к тебе не сразу, так что, возможно,  придется провести несколько сражений. Успехов тебе, вои{н|тельница}!\n%=12277%\n
Здравствуй-здравствуй, помощни{чек|ца}! Я уже чувствую, что вокруг тебя вьется сила великая, значит, созрело наше зелье.
Здравствуй, любезн{ый|ая} горожан{ин|ка}, как идут дела? В гору? Славно, славно. Присядь, отдохни, возьми кружечку-другую свежего пивка. В лавку заглядывай, товары осмотри, вон сколько добра хорошего. \n
Здравствуй, вои{н|тельница}, с чем пожаловал{|а} к старому мастеру?\n
Что ты говоришь, неужели Дух Зимы решился сделать это варево? Наверное, это ты вдохновил{|а} его на эту затею? Что ж, дело это важное, погода хорошая всем нужна. Вот тебе баночка сока, пусть послужит во благо!
Продолжим, Дух Зимы! Я готов{|а}!
Здравствуй, {добрый молодец|красна девица}! Ну что, продолжим варить снадобье погодное? В награду ты получишь: %=21814:200,11740:3%
Здравствуй, вои{н|тельница}, чувствуешь, как в последнее время земля под ногами задрожала? \n
Это земля так дрожит? Я уж думал{|а}, это меня так холод пробрал, что коленки трясутся. У вас тут сейсмически активная зона что ли?
Ну рассказывай, как продвигается коллекционирование коробочек? Собрал{|а} уже 12 штук для изготовления персональной гирлянды и украшения нашей красавицы-ёлочки?
Как проходят поиски, принес{|ла} необходимое количество коробок с игрушками? Всего надо 12 штучек, не забыл{|а}?
Да, что-то наменял{|а}, что-то добыл{|а} с боем... Но ровно по 3 коробочки с шариками каждого цвета удалось собрать!
О, мои ключи! Да, Радор мне уже передал весточку о ново{м|й} помощн{ике|ице}. Я выдам тебе пропуск на корабль, но для начала выполни еще несколько поручений. Мы все сейчас готовимся к празднику Эля, твоя помощь будет весьма кстати!\n
Праздник эля уже на носу, и, клянусь бородой Кхадгора, в этом году я приготовлю свой лучший эль! Правда, у меня еще ничего не готово... Ты появил{ся|ась} здесь очень вовремя. \n
Мое почтение, вои{н|тельница}! В поместье Гоббера Гробфта проходит веселое боевое состязание для гномов и людей в специально отведенных для этого местах. Поскольку сражение дружеское, то при проигрыше никто не получит штраф, но и победившему не достанется обычных наград - только призовые монеты, но и то если повезет. \nЧтобы разжечь азарт, предлагаю задание: одолеешь пятерых соперников, приходящихся тебе по силам - получишь от меня гарантированный приз в пять монет! Берешься?\n%=12385%
Вот, как и просили, выбрал{|а} еду на свой вкус - Зеленый чай!
Вообще-то пока не успел{|а} угоститься. Меня интересуют призовые монеты, говорят, у вас есть поручение?
Я принес{|ла} к столу спелые яблоки.
Гоббер Гробфт собственной персоной! Рад встречи, уважаем{ый|ая}! При поддержке столичных таверн в моем поместье проходят гуляния, посвященные большой встрече гномов и людей. Не желаете ли присоединиться? \n
Как же можно пропустить такое событие, непременно буду рад{|а} наведаться в ваше поместье. Только сообщите адресочек, как добраться до него.
Пока не отправляюсь, просто мимо проходил{|а}.\n
Ну как, воитель{|ница}, что выбираешь за свои старания?\nЗаберешь все подарки? %=2591,2588,2590,2592,2589% Или возьмешь один из хрустальных лепестков? Только я за него попрошу пополнить мой запас Хрустальных шаров. %=944:8%
Я все же решил{|а}  выбрать подарки к празднику.
Ну как, воитель{|ница}, что выбираешь за свои старания? \nЗаберешь все подарки? %=2591,2588,2590,2592,2589% Или возьмешь один из хрустальных лепестков? Только я за него попрошу пополнить мой запас Хрустальных шаров. %=944:8%
Постой! Пока ты не уш{ел|ла}, один совет: по прибытии в Кхатог поговори со стражником Хагмаром, он поможет тебе освоиться в городе гномов. Ты его найдешь сразу на пристани.
<i>&nbsp;&nbsp;&nbsp;&nbsp;&nbsp;&nbsp;&nbsp;&nbsp;&nbsp;&nbsp;&nbsp;&nbsp; Хагмар смотрит на вас с неподдельным интересом</i>\n\nТак это ты {тот самый воин, одолевший|та самая воительница, одолевшая} старосту Гофура! Бриз Шионского моря уже донес до меня рассказы о твоих приключениях в Ущелье Ледяных Ветров. Что же, добро пожаловать в Кхатог!
Постой! Пока ты не уш{ел|ла}, один совет: по прибытии в Лонгхольм поговори со стражником Гертоном, он поможет тебе освоиться в столице людей. Ты его найдешь сразу на пристани.
<i>&nbsp;&nbsp;&nbsp;&nbsp;&nbsp;&nbsp;&nbsp;&nbsp;&nbsp;&nbsp;&nbsp;&nbsp; Гертон смотрит на вас с недоверием</i>\n\nТак вот ты как{ой|ая}, спаситель{|ница} Мыса Спокойной Воды! Наслышан о твоих приключениях. Что ж, добро пожаловать в Лонгхольм!
Что ж, надеюсь, я не напрасно старал{ся|ась}.
Посетите места кровопролитных сражений в Соли-Доре и, если вы увидите курганы, значит, павшие воины древности сочли вас достойн{ым|ой} выполнить их поручение. \n\n%#1555:TRG:1%
Посетите места кровопролитных сражений в Соли-Доре и, если вы увидите курганы, значит, павшие воины древности сочли вас достойн{ым|ой} выполнить их поручение. \n\n%# 1556:TRG:1%
Воспользуйтесь тотемами Воды, чтобы заполучить Капли Вечности. Из них умелый алхимик сможет приготовить Дары Воды, которые нужно будет не только использовать само{му|ой}, но и поделиться с Агватором. \n\nРост репутации отважные мастера могут отслеживать в медалях Гильдии Воды. \n\nНаграда за задание: Репутация Гильдии Воды, новые медали и возможности.
Сражаясь с монстрами, вы получите Элементы Порядка. Из них умелый алхимик сможет приготовить Дары Порядка, которые нужно будет не только использовать само{му|й}, но и поделиться с Ордией. \n\nРост репутации отважные мастера могут отслеживать в медалях Гильдии Порядка. \n\nНаграда за задание: Репутация Гильдии Порядка, новые медали и возможности.
Сражаясь с монстрами, вы получите Элементы Порядка. Из них умелый алхимик сможет приготовить Дары Порядка, которые нужно будет не только использовать сам{ому|ой}, но и поделиться с Ордениусом. \n\nРост репутации отважные мастера могут отслеживать в медалях Ордена Порядка. \n\nНаграда за задание: Репутация Ордена Порядка, новые медали и возможности.
Воспользуйтесь тотемами Земли, чтобы заполучить Камни мироздания. Из них умелый алхимик сможет приготовить Дары Земли, которые можно использовать само{му|ой}, а также поделиться с Террагором для повышения вашей репутации в гильдии Земли. \n\nРост репутации отважные мастера могут отслеживать в медалях Гильдии Земли. \n\nНаграда за задание: Репутация Гильдии Земли, новые медали и возможности.
Воспользуйтесь тотемами Земли, чтобы заполучить Камни мироздания. Из них умелый алхимик сможет приготовить Дары Земли, которые можно использовать само{му|ой}, а также поделиться с Террусом для повышения вашей репутации в Ордене Земли.  \n\nРост репутации отважные мастера могут отслеживать в медалях Ордена Земли. \n\nРепутация Ордена Земли, новые медали и возможности.
Здравствуй, вои{н|тельница}, надеюсь, не просто так ко мне заглянул{|а}, я как раз присматриваю себе ученика. \n
Я пока не готов{|а} к такому испытанию, до встречи!\n
Вернул{ся|ась}, да не с пустыми руками? Это замечательно, я как раз подготовил для тебя эскиз, по которому ты сумеешь соткать жесткую ткань для пошива различных предметов амуниции.
Здравствуй, вои{н|тельница}! Скажи, бывали у тебя моменты, когда хотелось забыть об уровне своего мастерства и ринуться в жаркий бой с сильным противником?\n
Приветствую брав{ого|ую} воите{ля|льницу}! У меня к тебе один вопрос: желаешь ли ты скорее повысить уровень своего воинского мастерства?\n
Тогда сегодня твой день! Я наделю тебя силой всезнания - с ней ты будешь получать в два раза больше опыта, чем обычно, в сражениях с монстрами и врагами. Ты готов{|а} к покорению новых вершин?
Конечно, всегда готов{|а}, спасибо за такую возможность!
Вижу в твоих глазах сомнение. Что тебя беспокоит, вои{н|тельница}?
Это не проблема, {мой дорогой друг|дорогая моя}! Я тотчас прекращаю действие твоего эффекта!
Я принял{|а} поспешное решение о получаемом в сражениях опыте и хочу отменить действие этой магии.\n
По объявлению? Отлично, выглядишь крепк{им|ой}, и броня что надо. Проходи, у нас работы много. Я сейчас занят, сходи пока к Тенарону, он расскажет что к чему.\n
По объявлению? Отлично, выглядишь крепк{им|ой}, и броня что надо. Проходи, у нас работы много. Я сейчас занят, сходи пока к алхимику Хальмару, он расскажет что к чему.\n
Что за встреча! Привет, %NICK%! Еще недавно ты пытал{ся|ась} одолеть моего голема Соломона, и теперь ты здесь, в таких хороших доспехах, готов{ый|ая} ринуться в бой.\n
Тем тоннелям, по которым ты сюда ш{ел|ла}, уже сотни лет, наверное их строило еще первое поколение людей. Мы обнаружили здесь остатки бирмитовых россыпей, скорее всего здесь когда-то добывали самоцветы. Об этом не могли не знать эти ушлые Гробфты, они вечно лезут туда где можно найти дорогие побрякушки.
Слышал{|а} когда-нибудь про Скрабба? Слухи о твари, которая слоняется по старым шахтам, оказались ужасной реальностью. Да, %NICK%, мы находимся в том самом логове Скрабба. \n
Сначала я думал{|а}, что это шахта, но сомневаюсь все больше. На пещеру тоже не похоже. Так кто вырыл эти ходы?\n
Хорошо, рад{|а} был{|а} повидаться!
Да-да, я слышал{|а} про этих гоблинов. Так вы нашли их?
А, еще од{ин|на} искатель{|ница} сокровищ? Ну, не буду тебя томить, расскажу как есть. Изначальной целью нашего отряда был поиск следов пропавшей экспедиции Гробфтов. Когда мы приблизились к этим ходам, то поняли, что именно здесь встретили свою судьбу те гоблины. Они, видимо, искали, на чем бы еще подзаработать, и, думаю, что нашли. Мы обнаружили неподалеку бирмитовую крошку - вероятно, где-то здесь есть залежи самоцветов. Нам это еще предстоит выяснить. \n\n
Ты разве не знаешь? Скрабб же это. Ей-богу, ты хоть раз был{|а} в таверне Кхатога? Там о нем только и судачат. \n
Хорошо, рад{|а} был{|а} знакомству!
Ага, вернул{ся|ась}. Значит, рассказ Тенарона тебя не напугал?
Скорее, заинтересовал. Я готов{|а} выслушать ваш план.
Ага, вернул{ся|ась}. Значит, рассказ Хальмара тебя не напугал?
Я долж{ен|на} еще подумать, прежде чем браться за это.
Я готов{|а} потрудиться.
Эта мерзкая тварь быстро восстанавливает силы. Мы снова дадим бой Скраббу, как только соберется отряд опытных бойцов. Условия те же: пущу тебя в логово за двадцать знаков отличия. Ты готов{|а} снова поработать в отряде?\n
Отряд вот-вот выдвигается к логову Скрабба. Если ты уже собрал{|а}  двадцать знаков отличия экспедиции, я выдам тебе специальное... как бы это назвать... питье. Оно поможет преодолеть защитный барьер. Давай сюда знаки. %=12792%
Да, если хочешь войти в состав отряда. Такие у нас порядки. Ты думал{|а}, один раз собрал{|а} и теперь всегда сможешь состоять в элитном отряде? Нет, надо постоянно работать на экспедицию. Регулярная служба целям экспедиции - залог твоего успеха. Только наиболее опытные воины отправляются в самые опасные  походы. \n
Хорошо, я понял{|а}, вот мои знаки.
Я долж{ен|на} вернуть заработанные знаки отличия?\n
Я раздобыл{|а} Зеленый чай.
Набрал{|а} немного яблок для экспедиции.
Я не готов{|а} к сражению и отказываюсь от задания.
Отличная работа! Я видел, как ты повалил{|а} того толстяка на землю. Остальные гномы разбежались как жуки! Ха-ха! Горжусь таким бойцом в своем отряде! Держи заслуженные знаки, они твои!\n
Отличная работа! Я видел, как ты повалил{|а} того хлюпика на землю. Остальные людишки разбежались как жуки! Ха-ха! Горжусь таким бойцом в своем отряде! Держи заслуженные знаки, они твои!\n
Сейчас я не готов{|а} к такой битве.
Я не готов{|а} рисковать сегодня.
Хорошо, я буду осторож{ен|на}.
Я хоть и алхимик, но в тактике кое-что соображаю! Вижу, все силы брошены на изведение взрослых насекомых, но этого недостаточно. Ты посмотри, сколько здесь кладок, из них же появятся новые полчища! Я хочу, чтобы ты отправил{ся|ась} в ту пещеру и уничтожил{|а} как минимум пять кладок. Будет тебе за это знаки отличия экспедиции.\nТолько будь осмотрительней, когда будешь топтать эти яйца, вдруг оттуда полезет молодняк, они вполне способы защищаться.\n\n<b>Награда:</b> %=12790:15%
Я совсем забыл{|а}, у меня сегодня более важные дела.
Заметил{|а} что-нибудь любопытное вблизи брошенной шахты?
Я наш{ел|ла} вот этот медальон, он был втоптан в землю, и едва не ускользнул от моего взгляда.
Жаль, я очень надеялся обнаружить там какие-то подсказки. Но ты все равно заслужил{|а}  знак отличия, держи один. Завтра для тебя найдется новое задание, не забудь навестить экспедицию.\n
Заметил{|а} что-нибудь любопытное вблизи брошенной шахты?\n
Вы просите слишком многого, я пока не готов{|а} к такому.
Я понял{|а}, обязательно поищу жетоны павших.
Я думал{|а}, вы сделаете ее более вместительной, командующий.
Твои сапоги выглядят ужасно, вижу, ты от души прош{елся|лась} по кладкам улья.
Ну что, готов{|а} к улучшению своей сумки?
Я понял{|а} вас, Командующий.
Нашлись те жетоны, которые я просил?\n\nПрекрасно, я прямо сейчас возьмусь за усиление твоей сумки, думаю, ты не будешь разочарован{|а}. Но учти, вставленные в сумку инкрустационные камни и руна пропадут при ее усилении.\n
Да, я разыскал{|а} самые редкие жетоны. Трудно поверить, что столько доблестных людей оказалось погребено в этих подземельях. \n
Приветствую тебя на <b>Мысе Спокойной Воды</b>, %NICK%! Ты, конечно, хочешь отправиться в Лонгхольм? Я бы с радостью проводил тебя до пристани, но сейчас обстановка неспокойная. Посадка на корабль только по пропуску. \n\nЧтобы получить его, каждый новобранец проходит небольшое испытание. Ты готов{|а} проверить свои силы?
Почему ты так{ой|ая} мокр{ый|ая}, тоже пытал{ся|ась} одолеть водных элементалей? Это бесполезно. Пока источник магии, призвавший их, не иссякнет, они не исчезнут. \nТебя прислал Расмус, верно? Мне нужна помощь в поимке волшебника, который дестабилизировал магический фон Мыса. Это дело может быть опасным, так что я хочу убедиться, что твоих навыков достаточно. Сразись с моим ручным големом Соломоном, я должен увидеть, каков{|а} ты в бою. \n\n<b>Награда:</b>%$Exp:30,S:2%%=12%
Я уже вполне неплох{|а}, сейчас вы убедитесь!
Как хорошо, что ты приш{ел|ла}! Я еле сдерживаю тут незваную гостью. Она врывалась в каждый дом, пока я не остановила ее. Но моих сил на нее не хватает, нужна помощь настоящего воина! \n
Вот спасибо, теперь хоть с голоду не помру. Ты говорил{|а}, что разыскиваешь Альму? Ее дом прямо напротив причала. Выйди на дорожку и ступай на запад. Ох, лишь бы Шанда снова не появилась под моими окнами!\n
