Нда... Ну ладно, может быть, есть какие-то задания? Я же по делу приш{ел|ла}.
На что ты готов{|а} за монетку?
А ты уже справил{ся|ась}? Метеор, просто метеор...
Дар-р-рова, Вои{н|тельница}! Ка-а-ак слу-у-ужба?
А ч-ч-чего ты хотел{|а}?! Я готов пом-м-мочь!
Да вот, Бардин вручил мне этот механизм... Я подумал{|а}, что Вы можете рассказать, зачем он нужен.
Вои{н|тельница}... У меня просто нет слов. Ты и не представляешь, какое сокровище попало тебе в руки!
Ну как? Наш{ел|ла} чего-нибудь? Удалось узнать тайну обелиска?
Да, вот обнаружил{|а} эту склянку.
Здравствуй, Вои{н|тельница}. Что-то не вижу радости на твоём лице...
Да не то, чтобы задание... В общем, ты сам{|а} заинтересован{|а} в его выполнении. Я знаю, каким будет одно из испытаний Зальеса... И могу тебе подсказать, как поступать, чтобы удивить старика и выполнить задание досрочно.
Да вот, Сэмиус, подкинул мне твой учитель Зальес головоломку... Я забрал{|а} у Дилана странную руну, а чего делать с ней и не знаю.
Да, наковырял{|а} металлолома. Достаточно?
Вот, Вои{н|тельница}, мне удалось собрать тебе мешочек с этим притягивающим веществом...
Простите меня, но я очень занят{|а}.
А около фермы Дилана. Отправляйся туда и осторожно води этим мешочком над каждым стогом. Но будь аккурат{ен|на}! Мало ли что в них может заваляться железного... Вдруг кто-то свой меч потерял!
Принес{|ла} иголку?
Нет... Тут такое дело... В стоге оказались вилы, которые вылетели и проткнули мешок. Хорошо хоть я не пострадал{|а}, но вот это странное вещество рассыпалось.
Вои{н|тельница}! Поработать хочешь?!
Ну тогда слушай. Задание простое, но опасное. Поэтому платить я буду серьёзно. Я хочу, чтобы ты отправил{ся|ась} в Кварцевые долины и добыл{|а} для меня 2 шашки динамита из бочек с динамитом. Но будь осторож{ен|на}, велика вероятность детонации... И кто знает, куда тебя занесёт ударной волной!
Обугленн{ый|ая}, но непокорён{ный|ная}, наш{ герой|а героиня} вернул{ся|ась} с выполненным заданием к мудрому старцу...
Ну не обижайся. Ты выполнил{|а} важное задание и очень помог{|ла} мне!
Вои{н|тельница}, как проходит подготовка к испытаниям Зальеса?
Я рад{|а}! А, может быть, Вы сами расскажете что-нибудь?
Конечно, это будет не так просто, как на словах... Но в общих чертах ты прав{|а}.
Почему-то мне кажется, Вои{н|тельница}, что тебе есть много о чём рассказать...
Слушай, Вои{н|тельница}! Срочное поручение от Крагора! Он просит тебя починить центральную опреснительную установку!
Замечательно! Этому почтенному гному я всегда готов{|а} помочь!
Приветствую, Вои{н|тельница}! Чем могу помочь Вам?
Я приш{ел|ла} сообщить Вам, что я починил{|а} опреснительную установку.
Вои{н|тельница}, очень хорошо, что ты пока не уш{ел|ла}. Хочу ещё тебе работку предложить. Как ты насчёт того, чтобы заняться горным делом?
Наверное, я пока не готов{|а} к этому заданию.
Здравствуй, Вои{н|тельница}. Как проходят взрывные работы?
Да уже навзрывал{ся|ась}. Руда, корни, порошок. Вы об этом просили?
А ты уже всё собрал{|а}? Вот исполнительн{ый малый|ая какая}! Ну тогда держи награду.
Так вот, Вои{н|тельница}, сейчас я могу тебе немного рассказать об испытаниях Зальеса.
Видишь ли, в Шионском лесу есть несколько магических камней с написанными на них заклинаниями. Я хочу, чтобы ты их прочитал{|а}.
Чего-то ты быстро вернул{ся|ась}!
Рассказывай, Вои{н|тельница}. Я был прав про амулет?
Отдохнул{|а}, набрал{ся|ась} сил?
Простите меня, Дилан, но я не готов{|а} к сражениям с человекоящерами.\n
Да я и так сил{ен|ьна} и готов{|а} к любым испытаниям!
Хорошо, если так. В общем, слушай. Моё толкование слов, которые ты прочитал{|а} на камнях таково: Чтобы открыть более важные секреты, нам нужно начать с меньшего. Принеси мне кусок самого большого гриба на болотах, добудь у человекоящеров свиток с их пророчествами - они часто выносят его из своих селений, а также сруби красное дерево в Шионском Лесу, вот тебе топор.
То есть ты добыл{|а} свиток с пророчествами человекоящеров, кусок гриба и срубил{|а} красное дерево?
Хмм... Тогда приходи ко мне завтра. Подумай, о чём ты узнал{|а} после всех этих действий?
И Вам не болеть. Я выполнил{|а} Ваше задание.
Значит я долж{ен|на} убить их как бы по своей инициативе?
Да, ты правильно понял{|а}. Десяток уничтожишь?
Нет, простите, я очень занят{|а}.
Ну что, Джонни, набрал{|а} себе букетик Трифидов?
Боюсь, мо{я подруга|й друг} бы таких жертв не оценил{а|}...
Дорог{ой Воин|ая Воительница}, ты любишь цветы?
Ну что, набрал{|а} себе букетик Трифидов?
Вои{н|тельница}, раз уж ты тут... Не хочешь немного помочь мне?
Да я как раз занимал{ся|ась} по заданию Хильгора подрывными работами! Так что к динамиту мы гномы привычные!
Замечательно. Я готов{|а} выполнить Ваше задание.
Что-то, мне кажется, я вспомнил{|а} о другом срочном задании. Извините.
Расскажите, Вы не знаете, как взорвать кристаллы в Кварцевой долине? Я пытал{ся|ась}, но меня просто отбрасывало в сторону...
Ты вернул{ся|ась}?
Здравствуйте, {дяденька|тётенька}... Не хотите поиграть со мной?..
Что-то, мне кажется, я вспомнил{|а} о срочном деле. Извини.\n
Ты вернул{ся, дяденька|ась, тётенька}?
{Дяденька|Тётенька}, ну пожалуйста, попытайтесь! Спросите у дедушки Валиана, может он что-нибудь придумает?
Расскажите, вы не знаете средства для устойчивости при ходьбе у болот? Я пытал{ся|ась} несколько раз добыть для Лин кусочек древних развалин в Шионских болотах, но было слишком скользко и ничего не получалось...
{Дяденька|Тётенька}, надеюсь дедушка Валиан помог?
Да стой же ты, нетерпелив{ый|ая}! Да, я виноват, я пал жертвой искушения! Но я искренне надеюсь найти выход из его сетей!
Видите ли в чём дело, уважаемый... Я встретил{|а} на Острове Посвящения некое странное существо. Без сомнений, это существо, Ш'актайн, является порождением зла. Но он утверждает, что желает освободится от власти Тёмного Властелина, пусть и путём приобщения к древним культам. Вот я сейчас пытаюсь понять, можно ли этим его словам верить...
Добрый день, {Воин|Воительница}. Прошу меня простить, но я сейчас очень занят...
Здравствуй, Вои{н|тельница}. Я уже слышал Ваш разговор с моим мастером. Чем ты интересуешься?
Здравствуйте, уважаемый. Дело в том, что я встретил{|а} на Острове Посвящения весьма странное существо... Похоже, некогда это был прислужник Тёмного Властелина. Но сейчас он уверяет, что хочет избавиться от его гнёта и найти нового покровителя в культе Древних Богов. Вот я пытаюсь понять, не обман ли его слова?
Здравствуй, Вои{н|тельница}. Заходи, не стой на пороге. И дверь за собой затвори.
Простите меня, но я не готов{|а} сейчас к охоте на монстров.
Да, хочу тебе поручить одно задание. Вижу, ты уже освоил{ся|ась} в нашей деревне и вообще показал{|а} себя умел{ым Воином|ой Воительницей}, но вот как{ой ты Охотник|ая ты Охотница}?
Каково будет твоё решение, о Велик{ий Воин|ая Воительница}?
Пожалуй, я готов{|а} выслушать твоё предложение, порочный. Конечно, награда должна быть велика!
Ой, а я и не заметил, что ты приш{ел|ла}. Но раз ты здесь, я хочу тебе поручить одно задание. Вижу, ты уже освоил{ся|ась} в нашей деревне и вообще показал{|а} себя умел{ым Воином|ой Воительницей}, но вот как{ой ты Охотник|ая ты Охотница}?
Я хорош{ий охотник|ая охотница}! Я вот выполнил{|а}...
Молодец, что выполнил{|а}. А теперь докажи мне, что ты сможешь справиться с монстром, который заведомо сильнее тебя. Убей по 10 таких тварей и возвращайся ко мне. Тогда я смогу посвятить тебя в охотники. Конечно, и награда по такому случаю полагается.
Я хорош{ий охотник|ая охотница}! Я трижды...
Конечно, ты, наверное, уже привык{|ла} помогать жителям деревни. А теперь докажи мне, что ты сможешь справиться с монстром, который заведомо сильнее тебя. Убей по 10 таких тварей и возвращайся ко мне. Тогда я смогу посвятить тебя в охотники. Конечно, и награда по такому случаю полагается.
А я несколько десятков монстров уже убил{|а}...
Да я уже всё выполнил{|а}!
Ну успокойся, успокойся. Всё, ты прош{ёл|ла} проверку. Можешь получить свою награду, {друг мой|подруга моя}. Она вот там, в сундуке. Как раз тебя дожидается ещё с третьего десятка монстров.
Добрый день, {юноша|милая девушка}. Прошу меня простить, но я сейчас очень занят...
Добрый день, Вои{н|тельница}. Как служба, как семья?
А ты угадал{|а}. Снова требуется твой труд по расчистке подземелья. На этот раз твоей целью станут кристаниды. Знаешь таких? Это огромные ожившие кристаллы, обитающие практически в самом сердце гор. Ты же занял{ся|ась} охотой на монстров... Так надо довести работу до конца... Одни кристаниды остались неохваченными. Да что я рассказываю?! Ты же, наверняка, всё и так понимаешь.
С возвращением, победитель{|ница}!
Здравствуй, Виркли. Ты, как будто чувствуешь, когда я задание выполнил{|а}...
Нет, {дорогой друг|дорогая}, давай лучше по делу рассчитаемся. 1 золотой, как и обычно.
Так Вы {пивка налейте|ужин приготовьте}, я зайду!
Простите, Дафур, я вспомнил{|а} о другом срочном деле.
А ты угадал{|а}, Джонни. Снова требуется твой труд по расчистке подземелья. На этот раз твоей целью станут кристаниды. \nЗнаешь таких? Это огромные ожившие кристаллы, обитающие практически в самом сердце гор. Ты же занял{ся|ась} охотой на монстров... Так надо довести работу до конца... Одни кристаниды остались неохваченными. Да что я рассказываю тебе эти глупочти, Джонни?! Ты же, наверняка, всё и так понимаешь.
С возвращением, Джонни - победитель{|ница}!
Нет, {дорогой друг|дорогая}, давай лучше по делу рассчитаемся. 1 золотой, как и обычно.
Так Вы {пивка налейте|ужин приготовьте, свечи зажгите}, я зайду!
Здравствуйте, Дафур. Ты, как будто чувствуешь, когда я задание выполнил{|а}...
Да, Джонни. Как ты проницател{ен|ьна}... Действительно, Бобби был моим старым другом, который помогал мне выполнять приказы нашего принца вот уже десяток лет! И эти подлые существа не оставили от него даже доспехов...
Я бы рад{|а} помочь, Дафур, но вот вряд ли моих сил хватит...
Как Вы заметили раньше, я просто так Вас не посещаю. Конечно, я уже заплатил{|а} по долгам.
Здравствуй, мо{й помощник|я помощница}. Сможешь отомстить этим гадам?
Я бы рад{|а} помочь, но вот вряд ли моих сил хватит...
Да, Вои{н|тельница}. Как ты проницател{ен|ьна}... Действительно, это был мой старинный друг! Я уж и не помню, сколько раз он помогал мне... А эти подлые существа не оставили от него даже доспехов...
Ну что ты так{ой нетерпеливый|ая нетерпеливая}?! Нет в тебе чувства вкуса к красивым серьёзным рассказам!
Ну как ты хотел{|а}, коротко и по сути.
Боюсь, я не готов{|а} к этому заданию.\n
Да не сержусь я, прости старика... Понимаешь, Джонни, вот странность этих существ и привлекает наших учёных. Они возникли из ниоткуда, и ни крупицы магических сил в них нет! Несомненно, есть за этими существами некий секрет, который мы должны разгадать. Вот ты убил{|а} их, а теперь отряд самых учёных Гномов пойдёт по твоим следам и будет изучать их останки.
Ну что, гном{|а} давай-всё-побыстрее, убил{|а} десяток аномалий?
Не входи! Не смей! Кто ты так{ой|ая}, что вы все тут делаете?!
Это всё? Мне нужно убить 10 аномалий и вернуться к Вам за наградой? Я правильно понял{|а}?
Это я, Виркли. Я убил{|а} десяток Аномалий. Вы обещали мне награду...
Джонни, {друг мой|подруга}, что ты думаешь о Подражателях?
Вернул{ся|ась}! Жив{ой|ая}! А я уж и не чаял... Думал, сгинул{|а} мо{й|я} Джонни в подземелье...
Ах эти. Да, чего-то каждый раз при встрече с ними мороз по коже идёт. Особенно если они принимают мою внешность. Сражаться с сам{им|ой} собой не очень приятно. И, такое ощущение, будто они и навыки боя мои перенимают...
Во-о-от! Узнаю наш{его|у} скромн{ого героя|ую героиню}! Вот, возьми этот ящик с эликсирами в награду.
Воитель{|ница}, расскажи мне, что ты думаешь о Подражателях?
Ах эти. Да, чего-то каждый раз при встрече с ними мороз по коже идёт. Особенно если они принимают мою внешность. Сражаться с сам{им|ой} собой не очень приятно. И, такое ощущение, будто они и навыки боя мои перенимают...
Вернул{ся|ась}! Жив{ой|ая}! А я уж и не чаял... Думал, сгинул{|а} мо{й|я} помощни{к|ца} в подземелье...
Победитель{|ница} кобольдов снова с нами!
Путни{к|ца}, снова ты?! Не надоело ещё бегать ко мне?
А как иначе можно твоё возвращение понять? Если бы ты занимал{ся|ась} охотой на них, то сейчас бы помят{ый сидел в одном из коридоров|ая сидела в одном из коридоров} подземелья.
Слабое... Да как у этой желеобразоной массы можно его найти? Удар поглощает, магию отражает... А при атаке так вообще бросается на тебя, облепляет, и, если не задохнёшься раньше, то переваришься от его сока. Ах да, чуть не забыл. Даже если удастся как-то отбиться от его напора, будь готов{|а} к тому, что он восстановит все повреждения, стоит только тебе зазеваться!
Ну я искренне этому рад{|а}!
Ладно, ладно... Верю! Но тако{му великому воину|й великой воительнице} как-то не следует предлагать обычные эликсиры... Вот, возьми десять эпических эликсиров великана.
Ну спросите у кого-нибудь! Многие гномы видели, как я сражал{ся|ась} со слизнями!
Слабое... Да как у этой желеобразной массы можно его найти? Удар поглощает, магию отражает... А при атаке так вообще бросается на тебя, облепляет, и, если не задохнёшься раньше, то переваришься от его сока. Ах да, чуть не забыл. Даже если удастся как-то отбиться от его напора, будь готов{|а} к тому, что он восстановит все повреждения, стоит только тебе зазеваться!
Ну я искренне этому рад{|а}!
Ну что, Воитель{|ница}, последний удар - он трудный самый?
Ну спросите у кого-нибудь! Многие люди видели, как я сражал{ся|ась} со слизнями!
А как иначе можно твоё возвращение понять? Если бы ты занимал{ся|ась} охотой на них, то сейчас бы помят{ый сидел в одном из коридоров|ая сидела в одном из коридоров} подземелья.
Знаешь, Вои{н|тельница} я был не прав... Златован нашёл-таки повод для нового поручения!
А это не важно! Главное - факт победы. Молодчина. Могу с радостью сказать, что теперь ты с честью выполнил{|а} все приказы старосты. Давненько я такого не видел...Выбирай обещанную награду:\n%=1726,1729,1730%
Итак, Джонни... Тебе это удалось. Право, у меня даже и в мыслях не было, что у меня в помощниках ходит столь умел{ый Воин|ая Воительница}. Нет, я знал, что ты можешь выстоять даже в самых сложных сражениях... Но то, что ты так{ой герой|ая героиня}! Удивил{|а} старика!
Итак, Вои{н|тельница}, ты меня удивил{|а}... Тебе это удалось. Право, у меня даже и в мыслях не было, что у меня в помощниках ходит столь умел{ый Воин|ая Воительница}. Нет, я знал, что ты можешь выстоять даже в самых сложных сражениях... Но то, что ты так{ой герой|ая героиня}! Удивил{|а}, безумно удивил{|а}!
Да что тут такого... Я же не од{ин был|на была}! Мне помогали товарищи.
А это не важно! Главное - факт победы. Молодчина. Могу с радостью сказать, что теперь ты с честью выполнил{|а} все приказы старосты. Давненько я такого не видел... Выбирай обещанную награду:\n%=1726,1729,1730%
