<jsaction|showMessage("Обрати внимание на то, что только в постоянных сражениях можно закалить характер и повысить боевое мастерство. Чем больше врагов ты повергнешь, тем более опытн{ым|ой} и искусн{ым|ой} вои{ном|тельницей} станешь. Также многое будет за
<p>И кто это к нам пожаловал? Очередн{ой|ая} геро{й|иня}, мечтающ{ий|ая} о громких победах, славе и богатстве? Что же, в таком случае добро пожаловать на <b>Лонгхольмский призывной пункт</b>! Я помогу тебе стать прославлен{ым|ой} вои{ном|тельницей}, но сначала давай посмотрим, на что ты способ{ен|на}. Думаю, одного тренировочного боя с моим специально обученным големом будет достаточно.</p>\n<p align="center">&nbsp;</p>\n<p align="center"><b><font color="#ff0000">Защищайся!</font></b></p>
<p>&nbsp;Так, а кто это к нам пожаловал? Очередн{ой|ая} охотни{к|ца} за приключениями, славой и богатством? В таком случае рад приветствовать тебя на <b>Кхатогском призывном пункте</b>! Здесь ты узнаешь, что значит быть вои{ном|тельницей} грозного бога Кхадгора. А для начала давай посмотрим, на что ты способ{ен|на}. Думаю, одного <b>тренировочного боя</b> с моим специально обученным големом будет достаточно.</p>\n<p align="center"><font color="#ff0000"><b>Защищайся!</b>&nbsp;</font></p>
<p>&nbsp;Что же, раз ты утверждаешь, что владеешь навыками боя, я тебе поверю. В конце концов, если захочешь выжить, сражаться научишься. Итак, будем считать, что ты готов{|а} встать на опасную, но почетную стезю <b>защитни{ка|цы} Лонгхольма</b>, да хранит тебя Светлоликая Эквиль! &nbsp;Кстати, чуть не забыл. &nbsp;<b>Подойди </b>ко мне и<b> прими в дар набор боевых эликсиров</b>, который полагается каждо{му|й} новоиспеченно{му|й} вои{ну|тельнице}.&nbsp;</p>\n<p align="center"><img width="100" height="100" border="0" src="/files/popups/image/npc_vargos_frame(1).png" alt="" /></p><p>&nbsp;</p>
<p>Так ты говоришь, что умеешь сражаться. Тогда ты знаешь, что для того, чтобы выжить в нашем жестоком мире, тебе придется сталью и магией защищать свою жизнь. Отныне можешь считать себя полноправн{ым|ой} з<b>ащитни{ком|цей} Кхатога</b>! Кстати, специальный &nbsp;<b>набор магических эликсиров &nbsp;</b>полагается&nbsp;всем новобранцам. <b>Подойди </b>ко мне, и я с радостью его вручу.</p>\n<p align="center"><img src="/files/popups/image/npc_kardomar_frame.png" width="100" height="100" border="0" alt="" /></p><p>&nbsp;</p><p>&nbsp;</p>
<p><span style="text-indent: 35.4pt; ">Признаться, ты меня удивил{|а}. Нечасто встретишь гнома{|у} с такими способностями к ратному делу. Что-то мне подсказывает, что ты очень скоро станешь прославленным вои{ном|тельницей}, которая усилит наш славный Хирд. Поздравляю, ты прош{ел|ла} испытание и отныне можешь считать себя полноправн{ым|ой} защитни{ком|цей} Кхатога! Кстати, всем новобранцам полагается специальный набор магических эликсиров. Подойди ко мне, и я с радостью его вручу.</span></p><p>&nbsp;</p>
<p>&nbsp;<span style="text-indent: 35.4pt; ">Признаться, ты меня удивил{|а}. Нечасто встретишь гном{а|у} с такими способностями к ратному делу. Что-то мне подсказывает, что ты очень скоро станешь прославлен</span><span style="text-indent: 47.20000076293945px; ">{ным|ной}</span><span style="text-indent: 35.4pt; "> вои{ном|тельницей}, котор{ый|ая} усилит наш славный Хирд. Поздравляю, отныне можешь считать себя </span><b style="text-indent: 35.4pt; ">полноправн{ым|ой} защитни{ком|цей} Кхатога</b><span style="text-indent: 35.4pt; ">! Кстати, всем новобранцам полагается специальный </span><b style="text-indent: 35.4pt; ">набор магических эликсиров</b><span style="text-indent: 35.4pt; ">. </span><b style="text-indent: 35.4pt; ">Подойди </b><span style="text-indent: 35.4pt; ">ко мне, и я с радостью его вручу.&nbsp;</span></p>\n<p align="center"><img src="/files/popups/image/npc_kardomar_frame.png" width="100" height="100" border="0" alt="" /></p>
<p>&nbsp;<span style="font-size:11.0pt;line-height:115%;\nfont-family:&quot;Calibri&quot;,&quot;sans-serif&quot;;mso-ascii-theme-font:minor-latin;mso-fareast-font-family:\nCalibri;mso-fareast-theme-font:minor-latin;mso-hansi-theme-font:minor-latin;\nmso-bidi-font-family:&quot;Times New Roman&quot;;mso-bidi-theme-font:minor-bidi;\nmso-ansi-language:RU;mso-fareast-language:EN-US;mso-bidi-language:AR-SA">Неплохо, очень даже неплохо. С такими способностями ты быстро станешь мастером боя и опытн{ым|ой} маг{ом|ессой}. Думаю, что ты усвоил{|а} основы и отныне имеешь полное право именоваться защитни{ком|цей} Лонгхольма, да хранит тебя Светлоликая Эквиль! Да, чуть не забыл! <b>Подойди-ка ко мне</b>. Хочу вручить <b>набор боевых эликсиров</b>, который полагается каждо{му|й} новоиспеченно{му|й} вои{ну|тельнице}.</span></p>\n<p align="center"><img src="/files/popups/image/npc_vargos_frame(1).png" width="100" height="100" border="0" alt="" /></p>
<p>&nbsp;Запомни, только в постоянных сражениях можно закалить характер и повысить боевое мастерство. Чем больше врагов ты повергнешь, тем более опытн{ым|ой} и искусн{ым|ой} вои{ном|тельницей} станешь. Также многое будет зависеть от твоих характеристик, <b>снаряжения, оружия, медалей и, </b>конечно же, переменчивой<b> &nbsp;</b>фортуны! А теперь твое первое настоящее задание - сразись с коварными<b> Скотозаврами</b>, которые утащили мой <b>сапог</b>, и верни его! Уверен, тебе это по силам!</p>\n<p align="center"><img width="100" height="100" border="0" src="/files/popups/image/skotozavr_frame.png" alt="" /></p>
<p>&nbsp;А теперь пора заняться твоим <b>вооружением</b>. Доспехи тебе чуть позже выдаст наш Каптенармус, а вот <b>оружие </b>на складе не валяется. &nbsp;Его можно либо купить, либо получить в качестве трофея, либо изготовить самостоятельно. Но об этом ты и сам{|а} в скором времени узнаешь.  А пока давай смастерим хоть что-то похожее на <b>булаву </b>и <b>щит</b>. Пройди вниз и увидишь возле забора <b>кучу пиломатериалов</b>. Думаю, ты без труда отыщешь в ней длинный <b>прочный брусок</b>. Давай, я в тебя верю!</p>\n<p align="center"><img width="100" height="100" border="0" alt="" src="/files/popups/image/drova_1_frame.png" /></p>
<p>Отлично, из прочного <b>бруска </b>мы сделаем тебе <b>тренировочный меч</b>. Правда, лучше его при первой же возможности поменять на что-то посерьезнее. Таким мечом можно отмахаться только от самых безобидных монстров. Вот, держи <b>рубанок</b> и <b>киянку</b>, с их помощью ты сможешь сам{|а} изготовить свое первое оружие. А еще возьми <b>схему тренировочного меча</b> и обязательно ее <b>изучи</b>. Постой-постой, куда это ты его запрятал{|а}. Вот что, <b>открой</b>-ка свой <b>рюкзак</b> и <b>изучи схему</b> прямо сейчас, чтобы я видел.</p>\n<p align="center"><img src="/files/popups/image/helm_bag_frame.png" width="55" height="55" border="0" alt="" /> <img src="/files/popups/image/draw_sword_frame.png" width="55" height="55" border="0" alt="" /></p>
<p>Ну вот, теперь ты вооружен{|а} и сможешь за себя постоять. Однако, помни, не только оружие принесет тебе победу в боях.&nbsp;<b>Используй свой магический дар</b>. Со временем ты сможешь овладеть любой из ветвей магии и стать могущественным волшебником. А пока <b>открой магическую книгу</b> в левой вкладке <b>под изображением Шлема </b>и <b>выбери заклинание</b> себе по вкусу. Помни, ты сможешь изменить выбранную магию в любой момент.</p>\n<p align="center"><img width="100" height="100" border="0" src="/files/popups/image/magic_book_frame.png" alt="" /></p>
<p>Замечательно! Из этого <b>бруска </b>мы сделаем тебе <b>тренировочную булаву</b>. Правда, лучше ты это оружие поскорее поменяй на что-то посерьезнее, а то такой булавой можно отмахаться только от самых безобидных монстров. Вот, держи <b>рубанок</b> и <b>киянку</b>, с их помощью ты сможешь сам{|а} изготовить свое первое оружие. А еще возьми <b>схему тренировочной булавы</b> и обязательно ее <b>изучи</b>. Постой-постой, куда это ты его запрятал{|а}. Вот что, <b>открой</b>-ка свой <b>рюкзак</b> и <b>изучи схему</b> прямо сейчас, чтобы я видел.</p>\n<p align="center"><img src="/files/popups/image/helm_bag_frame.png" width="55" height="55" border="0" alt="" /> <img src="/files/popups/image/draw_mace_frame.png" width="55" height="55" border="0" alt="" /></p>
<p>Ну вот, теперь ты вооружен{|а} и сможешь за себя постоять. Однако, помни, не только оружие принесет тебе победу в боях. <b>Используй свой магический дар</b>. Со временем ты сможешь овладеть любой из ветвей магии и стать умелым инженером или могучим воином. А пока <b>открой магическую книгу</b> в левой вкладке <b>под изображением Шлема </b>и <b>выбери заклинание</b> себе по вкусу. Помни, ты сможешь изменить выбранную магию в любой момент.</p>\n<p align="center"><img width="100" height="100" border="0" src="/files/popups/image/magic_book_frame.png" alt="" /></p>
<p>Да, этот <b>прочный брусок </b>подойдет. Я смотрю, ты еще захватил{|а} <b>рубанок </b>и <b>киянку</b>, они тебе тоже пригодятся. Осталось <b>выучить схему тренировочной булавы</b>... Берегись, среди досок притаился огромный жук! <b><font color="#ff0000">К оружию!</font></b></p>\n<p align="center"><img width="100" height="100" border="0" src="/files/popups/image/bug_2_frame.png" alt="" /></p>
<p>Да уж, у нас тут всегда нужно быть начеку. Опасности подстерегают на каждом шагу. Но ты молодец, не растерял{ся|ась}! А главное, что теперь у тебя есть <b>прочный брусок</b>, <b>рубанок </b>и <b>киянка</b>.</p><p>Загляни в рюкзак и изучи <b>схему тренировочной булавы</b>.</p>\n<p align="center"><img width="55" height="55" border="0" alt="" src="/files/popups/image/helm_bag_frame.png" /> <img width="55" height="55" border="0" alt="" src="/files/popups/image/draw_mace_frame.png" /></p>
<p>Да уж, у нас тут всегда нужно быть начеку. Опасности подстерегают на каждом шагу. Но ты молодец, не растерял{ся|ась}! А главное, что теперь у тебя есть <b>прочный брусок</b>, <b>рубанок </b>и <b>киянка</b>.</p><p>Загляни в рюкзак и изучи <b>схему тренировочного меча</b>.</p>\n<p align="center"><img width="55" height="55" border="0" alt="" src="/files/popups/image/helm_bag_frame.png" /> <img width="55" height="55" border="0" alt="" src="/files/popups/image/draw_sword_frame.png" /></p>
<p>&nbsp;Поздравляю, с каждым боем твой уровень мастерства растет! Запомни - при победе над монстрами частенько можно получить деньги, полезные предметы, ресурсы и даже оружие.&nbsp;Теперь, если ты изучил{|а} схему щита и добыл{|а} 3 шкуры скотозавра, сможешь изготовить тренировочный щит.</p>
<p>&nbsp;Поздравляю, с каждым боем твой уровень мастерства растет! Запомни - при победе над монстрами частенько можно получить деньги, полезные предметы, ресурсы и даже оружие. &nbsp;Теперь, если ты изучил{|а} схему щита и добыл{|а} 3 шкуры скотозавра, сможешь изготовить тренировочный щит.</p>
<p>&nbsp;Да, тебя определенно ждет большая воинская слава. Теперь ничто не мешает изготовить <b>тренировочную булаву</b>, если ты изучил{|а} <b>схему </b>и добыл{|а} <b>прочный брусок</b>.</p>\n<p align="center"><img src="/files/popups/image/draw_mace_frame.png" width="50" height="50" border="0" alt="" /> <img src="/files/popups/image/brus.png" width="50" height="50" border="0" alt="" /></p>
<p>&nbsp;Да, тебя определенно ждет большая воинская слава. Теперь ничто не мешает изготовить <b>тренировочный меч</b>, если ты изучил{|а} <b>схему </b>и добыл{|а} <b>прочный брусок</b>.</p>\n<p align="center"><img src="/files/popups/image/draw_sword_frame.png" width="50" height="50" border="0" alt="" /> <img src="/files/popups/image/brus.png" width="50" height="50" border="0" alt="" /></p>
За выполнение заданий, приносящих пользу всему нашему народу, ты будешь щедро вознагражден{|а}!
Здравствуй, Вои{н|тельница}. Я смотрю, ты познакомил{ся|ась} со всеми нашими жителями и постепенно привыкаешь к новой обстановке. Чем скорее ты окрепнешь и повысишь свое боевое мастерство, тем большую пользу успеешь принести людям в борьбе с коварными гномами.
Приветствую, Вои{н|тельница}! Рад снова видеть новоиспеченн{ого|ую} житель{|ницу} Лонгхольма! Судя по твоему озадаченному виду, ты ко мне заш{ел|ла} не просто так, а по какому-то делу, да?
Необходимо посмотреть, на что ты способ{ен|на} в бою. Вокруг заставы расплодились пауки. Нужно уничтожить нескольких Паучьих королей, чтобы остановить рост популяции. Убей трех тварей, посмотрим, на что ты способ{ен|на}.\n\n<b>Награда:</b> %$Exp:60%%=165:5%
Замечательно, Вои{н|тельница}! Ты сделал{ |а} это! У тебя не плохо получилось. Теперь другие  пауки не посмеют нападать на скот в нашей деревне. Передохни немного и подходи за новым заданием.
Приветствую тебя, Вои{н|тельница}. Я подготовил %45%. Отнеси его как можно скорее. Ступай, и будь осторож{ен|на}. %=45% <b>Награда:</b> %$Exp:50%
Вернул{ся|ась}? Хорошо! Донован передал мне ответ?
Замечательно! Почитаю на досуге. Ты быстро справил{ся|ась} с заданием, я отмечу это в своем отчете королю.
Здравия желаю, храбр{ый|ая} Вои{н|тельница}. Вот какое задание есть для тебя.  Пауки  буквально заполонили наши земли. Странные они какие-то.... И агрессивные. Разберись с ними, и я щедро отблагодарю тебя. Скажем, за выполненную работу, я дам тебе несколько  полезных свитков. %=606:3,618:3%
Жив{ой?|ая?}? Тебя долго не было. Я уже начал за тебя волноваться. Рад, что с тобой все впорядке и ты готов{|а} к новым испытаниям!
Хвала Эквиль, ты вернул{ся|ась} жив{ым|ой} и практически невредим{ым|ой}. И, судя по всему, победа за тобой?!
Ты оказал{ |а} нам огромную услугу и заслужил{ |а} свою награду. Если бы не ты, пауки стали бы настоящим бедствием. Помнится, когда я еще был маленький, и ни о какой войне никто и слыхом не слыхивал, зашел к нам один старичок, весь опутанный паутиной...
Ах да. Награда. Держи пару эликсиров силы, с ним рубить врага будет легче. Удачи тебе, вои{н|тельница}! %=165:2%
Здравствуй, вои{н|тельница}! Я смотрю, ты познакомил{ся|ась} со всеми нашими жителями и постепенно привыкаешь к новой обстановке. Чем скорее ты окрепнешь и повысишь свое боевое мастерство, тем большую пользу успеешь принести нашему народу в борьбе с ненавистными людьми.
Рад снова видеть тебя, новоиспеченн{ый|ая} житель{|ница} Кхатога! Судя по твоему озадаченному виду, ты ко мне заш{ел|ла} не просто так, а по какому-то делу, да?
Ну что же, вои{н|тельница}, вот и пришло время подвергнуть тебя испытанию в твоей боевой подготовке. Ты долж{ен|на} победить настоящего противника, так как, начиная с этого дня, ты переводишься в ранг Бойца.\n\n<b>Награда:</b>%$Exp:50%%=153,165%
Ха-ха. Люблю шутников. Ты долж{ен|на} сразить обычного скелета, коих много в округе. Хотя можешь попытать счастье и с Големом.
Раз ты тут, то, как я понимаю, мой приказ выполнен? Надеюсь, ты проник{ся|лась} боем.
Совершенно верно, мастер Надум. Я добыл{|а} %50%.
{Молодец!|Умница!} Теперь тебя можно по праву называть бойцом. Прими мои поздравления и вот эту скромную награду!\n%$Exp:50%%=153,165%
Очень хорошо, что ты решил{|а} заглянуть сюда сейчас. Скелеты совсем потеряли страх и вчера напали на наших дозорных. Нужно немного разрядить их войско. Иди и успокой пятерых. Принеси мне пять сломанных костей как доказательство выполненного приказа. %=48%
Нет. Лови их по одному и... Ты знаешь, что нужно делать. Будь осторож{ен|на}.\n\n<b>Награда:</b> \n%$Exp:60,C:15%%=165:2%
Здравствуйте, мастер Надум. Все замечательно, спасибо. Я выполнил{|а} ваш приказ и угомонил{|а} всех скелетов.
Здравствуйте, господин Корагор. Я принес{|ла} рапорт %51%.
Воин, подойди ко мне. Я закончил чтение всех рапортов, что поступили ко мне сегодня. И в одном из них сказано о новом нападении скелета умершего воина. На этот раз он чуть не убил дозорного. Нужно что-то предпринять. И я знаю что. Раз ты уже имел{|а} дело со скелетами, то я поручаю тебе разобраться и с этим. Убей его и принеси мне %52%. %=52%
Здравия желаю, воин. Ты выглядишь помят{ым|ой}. Тебе удалось сразить старого воина?
Да, мне удалось сделать это. Хотя, хочу признаться, это было не легко. Он яростно цеплялся за свою... ммм... жизнь. Но я все равно сразил{|а} его.
Я слышал{|а}, что этот доспех сделан из зачарованной кожи. Это правда?
Здравствуй, Вои{н|тельница}! Проходи, садись.
Хм, польщен. Вижу, ты про меня уже наслышан{|а}, но все же представлюсь. Имя мне Торадор, состою на службе Кхатогу в звании капитана охотников за головами. Слыхал{|а} о таких?
Я бы с большим удовольствием послушал{|е} ваш рассказ еще раз. Уверен{|а}, что это будет крайне увлекательно.
Ты готов{|а} начать охоту за головами? Набери 2180 отваги и возвращайся ко мне, мы обсудим твою награду.
