Ну это же водные духи! Ты их убивал{|а}, был{|а} в{есь|ся} мокр{ый|ая}! Но я не вижу соли на твоей одежде! Это значит, что вода пресная! Так вот, принеси нам то, что останется от этих клятых духов. Хотя бы штучек пять %986%.
И вот вернул{ся|ась} наш{|а} геро{й|иня}! Я знаю, что ты выполнил{|а} задание, иначе и быть не может!
А скажи-ка мне, достойнейш{ий|ая} из людей, не всех ли ты водных духов убил{|а}?
Ну это же водные духи! Ты их убивал{|а}, был{|а} в{есь|ся} мокр{ый|ая}! Но я не вижу соли на твоей одежде! Это значит, что вода пресная! Так вот, принеси нам то, что останется от этих клятых духов. Хотя бы штучек пять %986%.  \n
Ну что, отчаянн{ый|ая} искатель{|ница} приключений, не скучаешь? Сдается мне, без дела тут маешься?
Рассказывайте скорее, не томите... Хоть какое-то приключение будет. А то я этот остров уже вдоль и поперёк исходил{|а}.
Крх, крх. Вои{н|тельница}, подойди поближе. Не бойся, я не причиню тебе вреда. Думаю, твои собратья уже рассказали обо мне и моей просьбе...
То есть, ты навсегда обречён стоять тут? Не хотел{|а} бы я, чтобы со мной такое случилось... А соседство с другими Скелетами тебя не смущает?
Вообще-то, кое-что удалось выяснить. Я наш{ел|ла} его, только он ничего не видит, а потому не может до тебя добраться.
Уже вернул{ся|ась}? Ну что, удалось что-нибудь узнать о моем штурмане?
Да, я так и подумал{|а}... Но он решил приживить себе черепашьи глаза. В общем,  как только к нему вернётся зрение, он придёт к тебе...
Напарник... А, старина Ветрогон! Слушай, я непременно должен его увидеть. Но мне нужна твоя помощь. Принеси мне глаза черепахи, сделай милость! Только будь осторож{ен|на}, не повреди их во время боя!
Стой, кто идёт!? Назовись! Не подходи ближе! Ты кто так{ой|ая}, я не помню твоего запаха!
Хмм... Знакомый запах. Это ты, мо{й|я}  помощни{к|ца}?
Приветствую прославленн{ого|ую} вои{на|тельницу}! Ну как, всех врагов уже одолел{|а}?
Рад видеть тебя в здравии, проходи. По делу заш{ел|ла} или как?
И я рад{|а} вас видеть. Я приш{ел|ла} к вам, потому что вы один из самых преданных защитников нашего народа, который уже многие годы бережет покой наших жителей. Быть может, вы знаете, как можно «почтить подвиг павших»?
Приветствую, странни{к|ца}, зачем ты здесь?
Все просто - если тебя и впрямь сочтут достой{ным|ной}, то они непременно привлекут твое внимание. Ищи могильные курганы в виде небольших каменных пирамидок, которые находятся в местах самых ожесточенных сражений.
Вот оно что. По правде сказать, ты обратил{ся|ась} по адресу. Я столько времени провел на Древнем погосте, что, кажется, уже начал понимать мертвых. Иногда их духи являются ко мне и смотрят долгим пронзающим взглядом, полным укора и упрека. Тоскуют они о том, что память о былых подвигах стерлась из воспоминаний большинства ныне живущих. А чем могу им помочь я? Мне ведь велено охранять покой усопших, а не воскрешать память о них...
Не знаю, не знаю, видишь ли, в чем дело... Как бы выразиться помягче... Не от каждого великие воины примут почести, лишь тот, кто увенчал себя славой и доблестью, кто мужественно сражался плечом к плечу со своими соплеменниками против общего врага, кто не раз был на волосок от смерти... Лишь так{ой|ая} вои{н|тельница} по-настоящему сможет почтить память павших.
Да, досточтимый страж Погоста, похоже, усопшие воины подают мне знак... Я увидел{|а} курган, как вы и говорили.
Я вижу, никакие преграды не смогут остановить тебя. Прекрасно, если бы все были такими инициативными и бесстрашными вои{нами|тельницами} как ты, мы бы уже давно стерли этих людей в порошок.
Я вижу, никакие преграды не смогут остановить тебя. Прекрасно, если бы все были такими инициативными и бесстрашными вои{нами|тельницами} как ты, мы бы уже давно стерли этих гномов в порошок.
Спасибо тебе, ты поистине велик{ий|ая} геро{й|иня}. Во сне мне явились образы тех, память о ком ты воскресил{|а}. Они просят передать тебе свою благодарность и приглашают туда, куда ныне живущим путь заказан.
Я готов{|а} отправиться в путь.
Это долгая история, но мертвые позволили мне проникнуть в этот склеп, и там я обнаружил{|а} девять плит с нанесенными на них рунами, которые выложены по кругу.
Да ты что! Неужели ты наш{ел|ла} легендарный «рунный круг»?
Э-э-э... что я наш{ел|ла}?
А, снова пожаловал{|а}. Полагаю, ты приш{ел|ла} ко мне, чтобы я проводил тебя до Древнего Погоста?
Да, я готов{|а} отправиться прямо сейчас.
Ну что ты так долго? Я уже все справочники перерыл, пока ты там где-то бродил{|а}... Показывай, что там у тебя?
Итак, ты принес{|ла}, что я просил?
У-ф-ф-ф, готово. Все, забирай. Руны зачарованы, осталось только активировать их. Это просто, даже ходить никуда не надо, они основаны на принципе дистанционной магии. Уверен, ты и сам{|а} справишься.
А, это наш{|а} отважн{ый|ая} искатель{|ница} приключений пожаловал{|а}. С чем приш{ел|ла}?
Ну что, горемычн{ый|ая}, никто не помог тебе с рунами?
Да нет, наоборот, я узнал{|а} название еще одной руны - «Щедрость».
Я принес{|ла} вам необходимые ресурсы, можно зачаровывать!
Кто это там ко мне пожаловал? А, это ты... ну говори, зачем приш{ел|ла}.
Я узнал{|а} название еще одной руны - «Знание».
Я принес{|ла} все, что вы просили, чтобы зачаровывать руну!
Кто ты так{ой|ая}? Я тебя не знаю, проваливай!
Ну чего, что узнал{|а}?
Посмотрите внимательнее, мы же с вами давно знакомы! Я не раз вам помогал{|а}! \nПожалуйста, откройте.
А, ты уже здесь. Полагаю, справил{ся|ась} с заданием?
Да, я принес{|ла} все необходимое, чтобы вы могли зачаровывать мне руну!
Опять ты. Неужто еще одно название руны узнал{|а}?
Я и отвечаю. Вот эта руна означает «Спать» или «Сон», как тебе удобнее. Уж это я знаю наверняка, будь уверен{|а}.
Ага, вижу ты все принес{|ла}.
Простите, если отвлек{|ла} вас от важных дел. Но у меня очень важное дело, в котором, мне кажется, только вы сможете помочь.
Я узнал{|а} название еще одной руны - «Хранение».
Вот радость привалила! Просто вот прямо безграничное счастье! Ладно уж, давай сюда. Сказать по правде, утомил{|а} ты меня изрядно. На вот, держи свою руну. И можешь не спешить возвращаться, мне надо отдохнуть от твоего общества.
Я принес{|ла} лапки темневика!
Вот радость-то привалила! Просто вот прямо безграничное счастье! Ладно уж, давай сюда. Сказать по правде, утомил{|а} ты меня изрядно. На вот, держи свою руну. И можешь не спешить возвращаться, мне надо отдохнуть от твоего общества.
Привет, рад тебя видеть! По делу заш{ел|ла} или просто проведать?
Да сколько же можно! Ты мне уже весь порог стер{|ла}! Не надоело ко мне ходить?
Оо-о-ох, как же изматывает эта работа... На вот, держи-ка свою руну. Надеюсь, мы все сделали правильно, и ты смог{|ла} активировать все руны, начертанные на плитах склепа.
Нужно воспроизвести руны в правильной последовательности. К сожалению, в каком именно порядке нужно коснуться плит, я не знаю. Мне кажется, ты и сам{|а} что-нибудь придумаешь. А теперь оставь меня, я уже слишком стар для всего этого...
Вот как... Ключ, значит. Что же, поздравляю тебя, это большой успех. Да и мне ты помог{|ла} - столько новых рун подсказал{|а}. Осталось ее зачаровать и активировать, так ведь?
По правде сказать, я и сам{|а} уже изрядно устал{|а}... Если можно было бы обойтись без этой беготни, я бы так и сделал{|а}, не сомневайтесь. Вот, я раздобыл{|а} название последней руны - «Ключ».
Оо-о-ох, как же изматывает эта работа... На вот, получай свою руну. Надеюсь, мы все сделали правильно, и ты смог{|ла} активировать все руны, начертанные на плитах склепа.
Приветствую, отважн{ый|ая} защитни{к|ца} наших границ. Рад видеть в здравии. Хочу поручить тебе одно крайне ответственное и важное задание.
Да, я не только слышал{|а} про курганы, но и видел{|а} их. Что вы хотите от меня?
Надо полагать, ты удачно справил{ся|ась} с заданием? Я в тебе и не сомневался. Думаю, прах воинов теперь будет покоиться в мире, а подвиг их навсегда останется в нашей памяти. Возьми эту награду, я тобой горжусь.
Приветствую тебя, смертн{ый|ая}, трепещи и внимай воле Богов!
Если вам будет по силам выполнить требования Богов, то в награду вы получите такие возможности, о которых не мечтал ни один смертный. Вы сможете набрать вдвое больше храбрых воинов, а на прилавке новой лавки появятся невиданные прежде артефакты и свитки, эликсиры и рецепты для всех профессий. Уверяю, ваши усилия не пропадут даром... Что скажешь, вои{н|тельница}?
Здравствуй, Вестник,  я в{есь|ся} обращен{|а} во слух.
Вестник, я готов{|а} выслушать ваши условия.
Готов{|а} ко второму испытанию? Ну что же, тогда слушай. Вы должны поразить Богов своей удалью и заполучить в боях с извечным врагом вашей расы следующие предметы:\n- Знаки тьмы, которые вы получите за убийства в Темных сводах,   \n- Кристаллы мудрости, что в катакомбах недруг копит\n- Знаки посвященных  на острове, солнцем и кровью залитом \n- И, наконец, нашивки вражеских лазутчиков в ядовитых лабиринтах шахт  \n\n\n%=3715,3713,3723,3719%
Давненько я тебя не видел, рад видеть  жив{ым|ой} и здоров{ым|ой}.
И я рад{|а} вас видеть. Я от Вестника, он...
Здравствуй, пытлив{ый|ая} ты наш{|а}. Рассказывай, чем там тебя одарили за разгадку тайны.
Здравствуй, пытлив{ый|ая} ты наш{|а}. Раззсказывай, чем там тебя одарили за разгадку тайны.
А-а-а, это снова ты. Ну показывай, чего принес{|ла}?
Да, понял{|а}, понял{|а}... к Корагору надо идти.
Да, понял{|а}, понял{|а}... к Златовану надо идти.
А, это ты. Милости прошу, в моем доме ты всегда желанн{ый|ая} гость{|я}. Что нового?
Нет, она мне дорога, я не хотел{|а} бы с ней расставаться. Лучше перерисуйте руны с обложки и поинтересуйтесь,  что они означают, хорошо?
Да ладно, не переживайте так. Я пошутил{|а}. Правда, смешно?
Вот это другое дело. Попрошу вас о маленьком одолжении - принесите мне десяток пробойников, добытых на Острове посвящения, и будем считать, что мы квиты! Уверен, для тако{го|й} отважно{го|й} и сильно{го|й} вои{на|тельницы} это большого труда не составит.
Я в восторге! Вы просто замечательн{ый|ая} союзни{к|ца}, а работать с вами одно удовольствие.
Хорошо проходит, очень успешно. Я уже собрал{|а} нужное количество, когда мы начнем обряд?
Я принес{|ла} камни.
Вы знаете, мне удалось прочесть содержимое этой древней книги, и что-то в моем восприятии неуловимо изменилось... вот только не пойму пока, что именно. Я вроде как стал{|а} Хранител{ем|ьницей} древнего фолианта, однако какие это мне сулит привилегии, до сих пор остается загадкой.
Хо-хо, почему-то я не удивлен, увидев тебя вновь... Как успехи с фолиантом, разгадал{|а} его тайну?
Приветствую новоиспеченн{ого|ую} Хранител{я|ьницу} мудрости Древних! Это великая честь и большая ответственность...
О, ты получишь достойную награду, не сомневайся! Начнем с того, что теперь тебе начнут открываться новые возможности, недоступные остальным обитателям нашего мира. Ты будешь видеть вещи, незримые для большинства, проникнешь в самую суть мироздания, изучишь новые рецепты... И все это в ближайшем будущем! А прямо сейчас Боги готовы вознаградить тебя, Хранитель{|ница} фолианта!
Отличная новость! Я готов{|а}, давайте награду.
В сражениях с опытными монстрами и нашими лютыми врагами. Будь стойк{им|ой}, не теряй надежды, и ты добудешь то, чего ждут Боги.
Приветствую, я смотрю, ты легко справил{ся|ась} с очередным заданием. Поздравляю, твои подвиги будут воспевать потомки, а Боги даруют свое благоволение. Как только ты передашь мне небесные жемчужины, я возложу их на алтарь, и благодать снизойдет на тебя, как только ты одержишь победу над любым противником.
Приветствую, геро{й|иня}! Слава о подвигах вашего клана долетела, наверное, даже до Гоб-Блинора. Чем могу помочь столь славно{му|й} вои{ну|тельнице}?
Нет, я пока не до конца определил{ся|ась}... Я к вам попозже загляну.
Приветствую доблестн{ого|ую} защитни{ка|цу} Лонгхольма. У меня есть к тебе очень интересное предложение.
Здравствуй, я тоже рад{|а} тебя видеть. Рассказывай, что за предложение?
Приветствую доблестн{ого|ую} защитни{ка|цу} Кхатога. У меня есть к тебе очень интересное предложение.
Ну что решил{ся|ась} ?
Пожалуй, я готов{|а} заключить сделку.\t
Я готов{|а} отдать 1000 знаков отличия 50 небесных жемчужин в обмен на Амулет Мракоборца.
Я готов{|а} отдать 1000 знаков отличия 50 небесных жемчужин в обмен на Амулет Диверсанта.
Привет, не ожидал{|а} меня увидеть?
Джуно, здравствуй. Сказать по правде, совсем не ожидал{|а}... Надолго к нам?
О, кто к нам пожаловал! Какими ветрами занесло в мою скромную обитель? Никак проголодал{ся|ась}? Кстати, хорошо, что заглянул{|а}, есть одно очень интересное  предложение.
Хе-хе, есть у меня помощники, не лишенные исследовательского духа, которые с энтузиазмом относятся к нашему сотрудничеству. Кстати, ты можешь стать одн{им|ой} из них. Предлагаю сделку - ты приносишь мне 5 разных бутылок редких сортов вин, а я тебе вручаю награду. Все по-честному.
Вот-вот, об этом я и хотел поговорить. Пора разнообразить ассортимент предлагаемых напитков для моих очень разборчивых клиентов, соглас{ен|на}? Хочу предложить истинным ценителям редкие сорта вин, которые сделают честь любому столу.
Ларчик с полезными банками и склянками, которые пригодятся тако{му|й} грозно{му|й} вои{ну|тельнице}, ко{им|ей} ты, безусловно, являешься.
Милости прошу к моему шалашу! Как там наша договоренность, не прекратил{|а} еще поиски?
Вы про редкое вино? Ни в коем случае! Более того, спешу вас порадовать - пять бутылок я уже наш{ел|ла} и готов{|а} совершить обмен.
Прекрасно, это лучшая новость за весь день! Ставь бутылочки сюда...  Замечательно, это именно то, что надо! Ты здорово поработал{|а} и, несомненно, заслужил{|а} эту награду, держи. Если вдруг найдешь еще бутылки, тащи их сюда, найдем им применение.
Приветствую тебя, славн{ый|ая} обитатель{|ница} Элинора. Рад нашей очередной встрече. \n
И я рад{|а} снова видеть вас в наших краях. Что-то вид у вас, Марко, какой-то озадаченный, случилось чего?
Замечательно! Большое тебе спасибо, ты меня здорово выручил{|а}. А вот и заслуженная награда, держи.
Ну что ты там у порога застрял{|а}, проходи скорее!
Здравствуйте, уважаемый Сэмиус. Вот решил{|а} к вам в гости заглянуть. Вы ведь у нас главный по питомцам. Я тут какой-то странный амулет повиновения наш{ел|ла}...
Здравствуйте, уважаемый Лагор. Вот решил{|а} к вам в гости заглянуть. Вы ведь у нас специалист по механическим  защитникам и помощникам. А я как раз какой-то странный пульт наш{ел|ла}...
